{
  "version": "1.0",
  "updated": "2026-08-28",
  "issue": 5859,
  "source": "docs/architecture/BOUNDED-CONTEXT-REGISTRY-AGENT-PLAN.md (PR #5900, table §2)",
  "contexts": [
    {
      "id": "01",
      "code": "BC-PLATFORM",
      "name": "Platform Core",
      "owner": "kitokoh",
      "priority": "P0",
      "status": "existing",
      "paths": [
        "api/app/Modules/Platform",
        "api/app/Modules/Onboarding",
        "api/app/Core/Feature",
        "api/app/Contracts/FeatureRegistryInterface.php",
        "api/app/Contracts/FeatureDetectorInterface.php"
      ],
      "dependencies": ["BC-TENANT", "BC-IDENTITY"],
      "routes": ["api/routes/web.php"],
      "migrations": ["api/database/migrations/public"],
      "events": [],
      "notes": "Catalogue, modules, provisioning, configuration globale et feature flags."
    },
    {
      "id": "02",
      "code": "BC-TENANT",
      "name": "Tenant & Isolation",
      "owner": "kitokoh",
      "priority": "P0",
      "status": "existing",
      "paths": [
        "api/app/Core/Tenant",
        "api/database/migrations/public",
        "api/database/migrations/tenant"
      ],
      "dependencies": [],
      "routes": [],
      "migrations": ["api/database/migrations/public", "api/database/migrations/tenant"],
      "events": [],
      "notes": "Entreprises, contexte actif, TenantManager, search_path, scopes et isolation."
    },
    {
      "id": "03",
      "code": "BC-IDENTITY",
      "name": "Identity & Access",
      "owner": "kitokoh",
      "priority": "P0",
      "status": "existing",
      "paths": ["api/app/Core/Auth", "api/app/Policies"],
      "dependencies": ["BC-TENANT"],
      "routes": ["api/routes/modules/user.php", "api/routes/modules/sso.php"],
      "migrations": [],
      "events": [],
      "notes": "Utilisateurs, memberships, rôles, permissions, invitations, sessions et Policies de base."
    },
    {
      "id": "04",
      "code": "BC-HR",
      "name": "Human Resources",
      "owner": "kitokoh",
      "priority": "P1",
      "status": "existing",
      "paths": ["api/app/Modules/HR"],
      "dependencies": ["BC-TENANT", "BC-IDENTITY"],
      "routes": ["api/routes/modules/rh.php", "api/routes/modules/hr_app.php", "api/routes/modules/hr_extended.php"],
      "migrations": [],
      "events": [],
      "notes": "Employés, contrats, départements, profils, documents RH et cycle de vie employé."
    },
    {
      "id": "05",
      "code": "BC-WORKFORCE",
      "name": "Attendance, Planning & Workforce",
      "owner": "kitokoh",
      "priority": "P1",
      "status": "existing",
      "paths": ["api/app/Modules/Attendance", "api/app/Modules/Planning"],
      "dependencies": ["BC-TENANT", "BC-HR"],
      "routes": ["api/routes/modules/planning.php", "api/routes/modules/tracking.php"],
      "migrations": [],
      "events": ["AttendanceCheckedIn", "AttendanceCheckedOut"],
      "notes": "Présence, shifts, planning, géolocalisation, modes de pointage et affectations."
    },
    {
      "id": "06",
      "code": "BC-LEAVE",
      "name": "Leave & Absence",
      "owner": "kitokoh",
      "priority": "P1",
      "status": "existing",
      "paths": ["api/app/Modules/Absence"],
      "dependencies": ["BC-TENANT", "BC-HR"],
      "routes": ["api/routes/modules/absence.php"],
      "migrations": [],
      "events": ["AbsenceApproved", "AbsenceRejected", "AbsenceRequested"],
      "notes": "Congés, absences, justificatifs, soldes, validations et calendrier d'absence."
    },
    {
      "id": "07",
      "code": "BC-PAYROLL",
      "name": "Payroll",
      "owner": "kitokoh",
      "priority": "P0",
      "status": "existing",
      "paths": ["api/app/Modules/Payroll"],
      "dependencies": ["BC-TENANT", "BC-HR", "BC-WORKFORCE", "BC-LEAVE"],
      "routes": ["api/routes/modules/payroll_engine.php"],
      "migrations": [],
      "events": [],
      "notes": "Périodes, règles, calculs, snapshots, bulletins, validations et exports paie."
    },
    {
      "id": "08",
      "code": "BC-ACCOUNTING",
      "name": "Accounting & Finance",
      "owner": "kitokoh",
      "priority": "P0",
      "status": "existing",
      "paths": ["api/app/Modules/Accounting"],
      "dependencies": ["BC-TENANT", "BC-PAYROLL"],
      "routes": ["api/routes/modules/accounting.php"],
      "migrations": [],
      "events": [],
      "notes": "Plan comptable, journaux, écritures, exercices, lettrage, FEC et états financiers."
    },
    {
      "id": "09",
      "code": "BC-EXPENSE",
      "name": "Expenses & Benefits",
      "owner": "kitokoh",
      "priority": "P2",
      "status": "existing",
      "paths": ["api/app/Modules/Expense"],
      "dependencies": ["BC-TENANT", "BC-HR"],
      "routes": ["api/routes/modules/expense.php"],
      "migrations": [],
      "events": [],
      "notes": "Dépenses, avances, prêts, remboursements et avantages, avec contrat Finance."
    },
    {
      "id": "10",
      "code": "BC-RECRUITMENT",
      "name": "Recruitment",
      "owner": "kitokoh",
      "priority": "P2",
      "status": "existing",
      "paths": ["api/app/Modules/Recruitment"],
      "dependencies": ["BC-TENANT", "BC-HR"],
      "routes": [],
      "migrations": [],
      "events": [],
      "notes": "Candidatures, postes, candidats, entretiens, décisions et onboarding d'embauche."
    },
    {
      "id": "11",
      "code": "BC-CRM",
      "name": "Customer CRM",
      "owner": "kitokoh",
      "priority": "P1",
      "status": "partial",
      "paths": ["api/app/Modules/CRM"],
      "dependencies": ["BC-TENANT", "BC-IDENTITY"],
      "routes": ["api/routes/modules/crm.php"],
      "migrations": [],
      "events": [],
      "notes": "Accounts, contacts, leads, opportunités, activités, tâches et pipelines du tenant. CRM client (distinct du CRM commercial plateforme, ADR-CRM-001/002)."
    },
    {
      "id": "12",
      "code": "BC-GROWTH",
      "name": "Marketing & Growth",
      "owner": "kitokoh",
      "priority": "P1",
      "status": "existing",
      "paths": ["api/app/Modules/Marketing", "api/app/Modules/Growth"],
      "dependencies": ["BC-TENANT", "BC-CRM"],
      "routes": ["api/routes/modules/marketing.php", "api/routes/modules/growth.php"],
      "migrations": [],
      "events": [],
      "notes": "Segments, campagnes, consentements, templates et marketing client."
    },
    {
      "id": "13",
      "code": "BC-COMMS",
      "name": "Notifications & Communications",
      "owner": "kitokoh",
      "priority": "P0",
      "status": "existing",
      "paths": ["api/app/Modules/Notification", "api/app/Contracts/Communication"],
      "dependencies": ["BC-TENANT", "BC-IDENTITY"],
      "routes": [],
      "migrations": [],
      "events": [],
      "notes": "Email, SMS, WhatsApp, préférences, templates, inbox/outbox et délivrabilité."
    },
    {
      "id": "14",
      "code": "BC-INTEGRATION",
      "name": "Integration Runtime",
      "owner": "kitokoh",
      "priority": "P0",
      "status": "existing",
      "paths": ["api/app/Jobs", "api/app/Contracts/Queue"],
      "dependencies": ["BC-TENANT", "BC-COMMS", "BC-DEVICE"],
      "routes": ["api/routes/modules/integrations.php"],
      "migrations": [],
      "events": [],
      "notes": "Webhooks, queues, inbox durable, outbox transactionnelle, adaptateurs et replay. Consomme EdgeSync (BC-DEVICE) par contrat."
    },
    {
      "id": "15",
      "code": "BC-FUEL",
      "name": "FuelStation",
      "owner": "kitokoh",
      "priority": "P0",
      "status": "to-create",
      "paths": ["api/app/Modules/FuelStation"],
      "dependencies": ["BC-PLATFORM", "BC-TENANT", "BC-IDENTITY", "BC-HR", "BC-WORKFORCE", "BC-COMMS"],
      "routes": [],
      "migrations": [],
      "events": [],
      "notes": "Stations, pompes, compteurs, sessions pompistes, photos/OCR, ventes, dépôts et bilans. Série FUEL-* (#5795+)."
    },
    {
      "id": "16",
      "code": "BC-EDU",
      "name": "EduManager",
      "owner": "kitokoh",
      "priority": "P1",
      "status": "to-create",
      "paths": ["api/app/Modules/EduManager"],
      "dependencies": ["BC-PLATFORM", "BC-TENANT", "BC-IDENTITY", "BC-HR", "BC-CRM"],
      "routes": [],
      "migrations": [],
      "events": [],
      "notes": "Campus, élèves, guardians, classes, présences, notes, bulletins et admissions. Série EDU-* (#5817+)."
    },
    {
      "id": "17",
      "code": "BC-RETAIL",
      "name": "Retail & POS",
      "owner": "kitokoh",
      "priority": "P3",
      "status": "to-create",
      "paths": ["api/app/Modules/Retail"],
      "dependencies": ["BC-PLATFORM", "BC-TENANT"],
      "routes": [],
      "migrations": [],
      "events": [],
      "notes": "Produits, magasins, caisse, tickets, stocks et synchronisation POS (futur)."
    },
    {
      "id": "18",
      "code": "BC-FIELD",
      "name": "Field Service & Fleet",
      "owner": "kitokoh",
      "priority": "P2",
      "status": "partial",
      "paths": ["api/app/Modules/Fleet"],
      "dependencies": ["BC-TENANT", "BC-HR"],
      "routes": [],
      "migrations": [],
      "events": [],
      "notes": "Véhicules, interventions, équipements, maintenance et opérations terrain génériques."
    },
    {
      "id": "19",
      "code": "BC-DEVICE",
      "name": "Devices, Cameras & Edge",
      "owner": "kitokoh",
      "priority": "P1",
      "status": "existing",
      "paths": ["api/app/Modules/Cameras", "api/app/Modules/EdgeSync"],
      "dependencies": ["BC-TENANT"],
      "routes": ["api/routes/modules/cameras.php"],
      "migrations": [],
      "events": [],
      "notes": "Appareils, kiosques, biométrie, synchronisation edge et politiques device. EdgeSync est possédé ici (BC-INTEGRATION le consomme par contrat)."
    },
    {
      "id": "20",
      "code": "BC-DOCUMENTS",
      "name": "Documents & Evidence",
      "owner": "kitokoh",
      "priority": "P1",
      "status": "partial",
      "paths": ["api/app/Modules/Cabinet"],